{
  "$schema": "https://json-schema.org/draft/2020-12/schema",
  "type": "object",
  "additionalProperties": false,
  "required": ["module", "name", "runtime", "tools"],
  "properties": {
    "minimumToolboxVersion": {
      "type": "string",
      "pattern": "^v[0-9]+\\.[0-9]+\\.[0-9]+(?:-[0-9A-Za-z-]+(?:\\.[0-9A-Za-z-]+)*)?(?:\\+[0-9A-Za-z-]+(?:\\.[0-9A-Za-z-]+)*)?$"
    },
    "module": {
      "type": "string",
      "minLength": 1,
      "description": "Canonical module path for this package."
    },
    "name": {
      "type": "string",
      "minLength": 1,
      "description": "Package name used as the tool namespace prefix."
    },
    "useWhenHint": {
      "type": "string",
      "maxLength": 100,
      "description": "Optional short guidance for when to use this package. Leave empty for obvious well-known services already likely to be in model training data. Omit the \"use {tool name } when\" but ensure  the hint follows the structure. E.g. [use skipup when ]scheduling meetings with multiple participants" 
    },
    "runtime": {
      "type": "string",
      "enum": ["typescript-sandbox", "typescript+wasix-sandbox", "typescript+wasip2-sandbox"],
      "description": "Execution runtime for the tool's TypeScript code."
    },
    "additionalTypeScriptGlobs": {
      "type": "array",
      "description": "Extra glob patterns for TypeScript files to include beyond tool entries.",
      "items": {
        "type": "string",
        "minLength": 1
      }
    },
    "sha256": {
      "type": "string"
    },
    "executables": {
      "type": "object",
      "description": "Map of binary name to WASM file path for WASM-based tools.",
      "additionalProperties": {
        "type": "string",
        "minLength": 1
      }
    },
    "credentials": {
      "type": "array",
      "description": "Credential declarations for OAuth2, API key, or bearer token injection.",
      "items": {
        "type": "object",
        "additionalProperties": false,
        "required": ["name", "type", "inject"],
        "properties": {
          "name": { "type": "string", "minLength": 1 },
          "type": { "type": "string", "enum": ["oauth2", "api_key", "bearer"] },
          "instructions": { "type": "string" },
          "provider": {
            "oneOf": [
              { "type": "string" },
              { "type": "object", "properties": { "name": {"type": "string"}, "auth_params": {"type": "object", "additionalProperties": {"type": "string"}}, "pkce": {"type": "boolean"} }, "required": ["name"] },
              { "type": "object", "properties": { "auth_url": {"type": "string"}, "token_url": {"type": "string"}, "auth_params": {"type": "object", "additionalProperties": {"type": "string"}}, "pkce": {"type": "boolean"} }, "required": ["auth_url", "token_url"] }
            ]
          },
          "scopes": { "type": "array", "items": { "type": "string" } },
          "inject": {
            "type": "object",
            "additionalProperties": false,
            "required": ["hosts", "method"],
            "properties": {
              "hosts": { "type": "array", "items": { "type": "string", "minLength": 1 } },
              "method": { "type": "string", "enum": ["bearer_header", "basic_auth", "api_key_header", "api_key_query"] },
              "header_name": { "type": "string", "minLength": 1, "description": "Custom header name for api_key_header method. Defaults to X-API-Key." },
              "path_prefix": { "type": "string" },
              "allow_unsafe_http_injection": { "type": "boolean" }
            }
          }
        }
      }
    },
    "allowed_hosts": {
      "type": "array",
      "description": "Hosts that tools in this package are allowed to contact.",
      "items": { "type": "string", "minLength": 1 }
    },
    "resources": {
      "type": "array",
      "description": "Package-level callable resource selectors used to shape the code-mode API.",
      "items": {
        "type": "object",
        "additionalProperties": false,
        "required": ["path", "params"],
        "properties": {
          "path": { "type": "string", "minLength": 1 },
          "params": {
            "type": "array",
            "minItems": 1,
            "items": {
              "type": "object",
              "additionalProperties": false,
              "required": ["name"],
              "properties": {
                "name": { "type": "string", "minLength": 1 },
                "binding_name": { "type": "string", "minLength": 1 }
              }
            }
          }
        }
      }
    },
    "tools": {
      "type": "array",
      "description": "Tool definitions. Each tool has an entry TypeScript file.",
      "items": {
        "type": "object",
        "additionalProperties": false,
        "required": ["entry_ts"],
        "properties": {
          "entry_ts": {
            "type": "string",
            "minLength": 1,
            "description": "Path to the tool's TypeScript entry file, relative to the package root."
          },
          "effect": {
            "type": "string",
            "enum": ["readOnly", "reversible", "irreversible"],
            "description": "Data access level. readOnly: no side effects (e.g. list, get, search). reversible: creates data that can be undone (e.g. create draft, add tag). irreversible: may edit or delete data, or cause irreversible side effects (e.g. send message, update record, delete)."
          },
          "idempotent": {
            "type": "boolean",
            "description": "Whether calling this tool multiple times with the same input produces the same result."
          },
          "description": {
            "type": "string",
            "description": "Human-readable description of what the tool does."
          },
          "paramsSchema": {
            "type": "object",
            "description": "JSON Schema for the tool's input parameters."
          }
        }
      }
    }
  },
  "allOf": [
    {
      "if": {
        "properties": {
          "runtime": { "const": "typescript-sandbox" }
        }
      },
      "then": {
        "not": {
          "required": ["executables"]
        }
      }
    }
  ]
}
